{
  "$schema": "http://json-schema.org/draft-07/schema#",
  "type": "object",
  "properties": {
    "app": {
      "type": "object",
      "properties": {
        "name": { "type": "string" },
        "version": { "type": "string" },
        "environment": { "type": "string", "enum": ["development", "production"] }
      },
      "required": ["name", "version", "environment"]
    },
    "api": {
      "type": "object",
      "properties": {
        "baseUrl": { "type": "string" },
        "timeout": { "type": "number" }
      },
      "required": ["baseUrl", "timeout"]
    },
    "database": {
      "type": "object",
      "properties": {
        "host": { "type": "string" },
        "port": { "type": "number" },
        "name": { "type": "string" }
      },
      "required": ["host", "port", "name"]
    },
    "supabase": {
      "type": "object",
      "properties": {
        "url": { "type": "string" },
        "anonKey": { "type": "string" }
      },
      "required": ["url", "anonKey"]
    },
    "features": {
      "type": "object",
      "properties": {
        "enableGraphExplorer": { "type": "boolean" },
        "enableAIHub": { "type": "boolean" },
        "enableRealTimeSync": { "type": "boolean" }
      },
      "required": ["enableGraphExplorer", "enableAIHub", "enableRealTimeSync"]
    }
  },
  "required": ["app", "api", "database", "supabase", "features"]
}