{
  "app": {
    "name": "WorkDev Core",
    "version": "1.0.0",
    "environment": "development"
  },
  "api": {
    "baseUrl": "/api",
    "timeout": 30000
  },
  "database": {
    "host": "localhost",
    "port": 5432,
    "name": "workdev"
  },
  "supabase": {
    "url": "",
    "anonKey": ""
  },
  "features": {
    "enableGraphExplorer": true,
    "enableAIHub": true,
    "enableRealTimeSync": false
  }
}